{
  "insights": [
    {
      "id": "b93ad5a6-17b9-41a4-b238-7eb8c7135d65",
      "source_name": "Fintech Startup Porter's Five Forces Analysis 2025 - FinModelsLab",
      "url": "https://finmodelslab.com/products/fintech-startup-five-forces?srsltid=AfmBOoqXQgOz_Lh_VZ1WG__V-IRnP5JwjO57pqJjGW3rxZx_hwAv_tXL",
      "porter_force": "New Entrants",
      "keywords": "FinTech AI fleet optimization startups, Automotive finance tech new companies, IoT FinTech asset management recent, Predictive maintenance insurance tech startups, Mobility fintech venture capital, Embedded finance transportation solutions, Digital lending vehicle fleets innovations, Regulatory sandboxes auto finance",
      "content": "Fintech Startup Porter’s Five Forces [Updated 2025] Financial Models Business Plans Tools 0 EN EN FR ES Home Porter's Five Forces Analysis Fintech Startup Porter's Five Forces Analysis 2025 Fintech Startup Porter's Five Forces Analysis 2025 $29.00 $15.00 1 review Out of stock ADD TO CART Pre-order DOWNLOAD FREE TRIAL Comprehensive, ready-made Porter's Five Forces Analysis Template — designed to save time while providing clear insights ● Industry-Specific Options ● 100% Editable ● Concise Takeaways ● Clear Formatting ● Instant Download Fintech Startup Bundle Fintech Startup Bundle Porter's Five Forces $29 $15 Financial Model $199 $199 $119 Business Plan $79 $79 $49 Pitch Deck $49 $49 $29 Value Proposition $29 $29 $15 One-Page Proposal $29 $29 $15 SWOT Analysis $29 $29 $15 Canvas $29 $29 $15 PESTEL Analysis $29 $29 $15 Maketing Mix (4 Ps) $29 $29 $15 BCG Matrix $29 $29 $15 Marketing Plan $29 $29 $15 Financial Dashboard $29 $19 3 Statements Model $49 $29 Total: ADD SELECTED TO CART Description Reviews Description Home Power of Suppliers Power of Customers Competitive Rivalry Threat of Substitutes Threat of New Entrants In the dynamic landscape of financial management, understanding the competitive forces at play is crucial for success. Conducting a Five Forces Analysis equips businesses with invaluable insights into supplier power, customer behavior, competitive rivalry, substitutes, and the threat of new entrants. This strategic framework not only highlights potential challenges, such as the limited number of specialized developers and the intense competition from both established players and emerging fintech startups, but also reveals opportunities for differentiation through technology and tailored services. By utilizing our adaptable Five Forces Analysis template, you can effectively navigate these complexities, uncover strategic advantages, and position your business for sustainable growth. Fintech Startup - Porter's Five Forces: Bargaining power of suppliers Limited number of specialized AI and software developers The fintech industry heavily relies on a skilled workforce, particularly in AI and software development. As of 2023, the demand for AI talent has surged, with over 80% of companies reporting difficulties in hiring qualified candidates. This limited supply allows skilled developers to command higher salaries and better working conditions, translating to significant costs for startups. High dependency on accounting software providers for integration Integrating with established accounting software is critical for a fintech solution targeting SMEs. Many startups find themselves at the mercy of a few dominant players in this space. For instance, 75% of small to medium financial technology firms rely on integrations with platforms like QuickBooks or Xero. This dependency can lead to increased costs if these providers decide to raise fees or limit access to their APIs. Specialized financial consulting services may have high fees The finance consulting landscape is rife with firms that offer specialized knowledge for fintech operations. Fees for these consulting services can vary significantly, with average hourly rates ranging from $150 to $400 depending on niche expertise and geographic location. This can considerably impact the startup's operating budget, especially in early-stage financing. Potential for partnerships to mitigate supplier power dynamics Forming strategic partnerships with suppliers can help startups reduce their bargaining power. By collaborating with AI firms, fintech startups can negotiate better terms and potentially lower prices. For instance, a partnership with an AI-based analytics provider could lead to costs decreasing by as much as 25% , enabling startups to allocate resources more effectively. Quality and reliability of supplier services affect platform performance The quality of services provided by suppliers directly impacts the overall performance of the fintech platform. A survey conducted in 2022 revealed that 67% of SMEs consider service reliability a top criterion when choosing fintech solutions. If suppliers fail to deliver consistent, high-quality services, it can lead to customer dissatisfaction and increased churn rates, which may cost startups significantly in lost revenues. Supplier Type Impact on Startup Average Cost/Rate AI Developers Limited availability drives up salary costs $120,000 - $200,000/year Accounting Software Providers Dependency on few players for integration $30 - $60/month per user Financial Consultants High fees can impact cash flow $150 - $400/hour AI Analytics Firms Partnerships can reduce costs Potentially 25% savings Expert-built startup financial model templates Investor-friendly Easy-to-use Excel & PPT templates CPA-developed financials 30+ charts and metrics Get Template Fintech Startup - Porter's Five Forces: Bargaining power of customers SMEs have multiple financial management options Small and medium-sized enterprises (SMEs) today face a plethora of choices when it comes to financial management solutions. With over 1.5 million SME-focused software products available globally, businesses can select from traditional accounting software, cloud-based solutions, or AI-driven platforms like the one described. This diversity amplifies the bargaining power of customers, allowing them to negotiate better terms and conditions. Increased price sensitivity due to budget constraints in smaller businesses SMEs often operate with stringent budgets. According to a study by Statista , about 70% of SMEs cite budget constraints as the primary factor influencing their financial decisions. This price sensitivity drives customer expectations for competitive pricing and exceptional value in financial management solutions. Access to online reviews influences customer choices In the digital age, customer opinions can significantly impact business success. Research indicates that 84% of people trust online reviews as much as personal recommendations, according to BrightLocal . This statistic underscores the importance of maintaining a robust online reputation for fintech startups, as potential customers often rely on reviews and ratings when selecting financial tools. Customers can easily switch to competitors if dissatisfied The low switching costs associated with fintech solutions empower customers to change providers readily. A survey by PwC found that 50% of customers would switch providers after a single negative experience. For SMEs, this means that retaining customers requires consistent quality and excellent service delivery. Demand for personalized services may give leverage to larger clients While smaller businesses seek affordable solutions, larger clients often demand tailored services, which can shift bargaining dynamics. In a report by McKinsey , it was noted that 72% of larger enterprises expect personalized services from their financial technology providers, asserting significant bargaining power in this segment. Factor Statistical Data Impact on Bargaining Power Number of Financial Software Solutions 1.5 million Increases customer choices, enhancing bargaining power SMEs Citing Budget Constraints 70% Leads to price sensitivity and demand for better value Trust in Online Reviews 84% Influences customer decisions and competitive dynamics Customers Willing to Switch Providers 50% Encourages firms to focus on customer satisfaction Demand for Personalization by Larger Clients 72% Shifts bargaining power towards larger enterprises Fintech Startup - Porter's Five Forces: Competitive rivalry Intense competition from established financial management platforms The financial management landscape is crowded with established players. Major platforms like QuickBooks and Xero dominate, boasting millions of users and a market share that reflects their deep-rooted presence. For instance, QuickBooks holds an impressive **70%** market share among small businesses, showcasing significant competitive ",
      "entities": {
        "organizations": [
          "Fintech Startup Porter",
          "Five Forces",
          "Five Forces Analysis Fintech Startup Porter's",
          "Five Forces Analysis",
          "Fintech Startup Porter's",
          "Five Forces Analysis",
          "Five Forces Analysis Template",
          "Five Forces",
          "Financial Model",
          "Pitch Deck",
          "SWOT Analysis",
          "PESTEL Analysis",
          "Maketing Mix",
          "Ps",
          "BCG",
          "Financial Dashboard",
          "Five Forces Analysis",
          "Fintech Startup - Porter's",
          "Limited",
          "AI",
          "AI",
          "QuickBooks",
          "AI",
          "fintech startups",
          "AI",
          "fintech",
          "Financial Consultants",
          "AI Analytics Firms Partnerships",
          "Small",
          "SME",
          "BrightLocal",
          "PwC",
          "Financial Software Solutions",
          "Online Reviews",
          "QuickBooks",
          "QuickBooks"
        ],
        "people": [
          "Porter",
          "Xero",
          "Statista",
          "McKinsey",
          "Xero"
        ],
        "locations": []
      },
      "dates": [],
      "timestamp": "2025-08-14T11:00:46.347549Z",
      "content_summary": "**Fintech Market Insights for New Entrants (2025)**\n\n**Key Findings:**\n\n- **High Competitive Rivalry**: Established players and emerging fintech startups intensify competition.\n- **Limited Supplier Power**: Specialized developers are scarce, but fintech startups can differentiate through technology and tailored services.\n- **Threat of Substitutes**: Alternative financial services and products pose a threat to fintech startups.\n- **Growing Demand**: Increasing adoption of digital financial services drives market growth.\n\n**Competitors:**\n\n- Established players in the financial industry\n- Emerging fintech startups\n\n**Market Trends:**\n\n- Growing demand for digital financial services\n- Increasing adoption of fintech solutions\n\n**Strategic Moves:**\n\n- Differentiate through technology and tailored services\n- Leverage adaptable business models to navigate market complexities\n- Focus on strategic partnerships to access specialized developers and expertise.\n\n**Recommendations for New Entrants:**\n\n- Conduct a thorough Five Forces Analysis to understand market dynamics\n- Develop a unique value proposition to differentiate from competitors\n- Focus on strategic partnerships and adaptable business models to drive growth."
    },
    {
      "id": "5b8b3c86-89bf-4d79-b476-8f240c7da3b1",
      "source_name": "Financial Technology Porter's Five Forces Analysis 2025",
      "url": "https://finmodelslab.com/products/financial-technology-five-forces?srsltid=AfmBOorUGrD-vFVl7EDoEk574hlIlmGoe7aDBlQh9Uv8M3LRK4n8PapH",
      "porter_force": "New Entrants",
      "keywords": "FinTech AI fleet optimization startups, Automotive finance tech new companies, IoT FinTech asset management recent, Predictive maintenance insurance tech startups, Mobility fintech venture capital, Embedded finance transportation solutions, Digital lending vehicle fleets innovations, Regulatory sandboxes auto finance",
      "content": "Financial Technology Porter’s Five Forces [Updated 2025] Financial Models Business Plans Tools 0 EN EN FR ES Home Porter's Five Forces Analysis Financial Technology Porter's Five Forces Analysis 2025 Financial Technology Porter's Five Forces Analysis 2025 $29.00 $15.00 1 review Out of stock ADD TO CART Pre-order DOWNLOAD FREE TRIAL Comprehensive, ready-made Porter's Five Forces Analysis Template — designed to save time while providing clear insights ● Industry-Specific Options ● 100% Editable ● Concise Takeaways ● Clear Formatting ● Instant Download Financial Technology Bundle Financial Technology Bundle Porter's Five Forces $29 $15 Financial Model $199 $199 $119 Business Plan $79 $79 $49 Pitch Deck $49 $49 $29 Value Proposition $29 $29 $15 One-Page Proposal $29 $29 $15 SWOT Analysis $29 $29 $15 Canvas $29 $29 $15 PESTEL Analysis $29 $29 $15 Maketing Mix (4 Ps) $29 $29 $15 BCG Matrix $29 $29 $15 Marketing Plan $29 $29 $15 Financial Dashboard $29 $19 3 Statements Model $49 $29 Total: ADD SELECTED TO CART Description Reviews Description Home Power of Suppliers Power of Customers Competitive Rivalry Threat of Substitutes Threat of New Entrants Understanding the competitive landscape is crucial for any business aiming to thrive in today's dynamic market. A Five Forces Analysis provides valuable insights into the competitive pressures that shape your industry's profitability, empowering you to make informed decisions. By evaluating the bargaining power of suppliers and customers, the intensity of competitive rivalry, the threat of substitutes, and the potential for new entrants, you can strategically position your business for success. As you build your Five Forces Analysis using our template, you’ll gain a clear perspective on the factors influencing your sector, allowing you to identify opportunities and mitigate risks effectively. Embrace this strategic framework to navigate your industry with confidence and drive sustainable growth. Financial Technology - Porter's Five Forces: Bargaining power of suppliers Limited number of specialized AI technology providers The landscape of financial technology is unique, particularly when considering the reliance on specialized AI technology providers. Currently, there are less than 100 established AI firms focusing specifically on the financial services sector, leading to a relatively limited supply. This restriction creates a scenario where the bargaining power of suppliers is elevated. Since many fintech companies require tailored AI solutions that align with their specific operational needs, these suppliers can dictate terms, including pricing and terms of service. Dependence on quality and reliability of suppliers for integrations With the increasing complexity of financial services, the demand for high-quality and reliable technology integrations has surged. Companies like Plaid and Stripe dominate the sector, providing essential services that many fintech firms rely on. A study by Gartner indicates that 70% of fintech firms consider the reliability of their suppliers as a critical factor in their operational success. If a chosen supplier fails to deliver, the repercussions can be severe, including service disruptions that can lead to customer loss and reputational damage. High switching costs associated with changing technology partners Switching costs in the fintech space can be daunting, often involving significant financial and operational implications. The costs associated with transitioning to a new supplier include not only direct financial expenses, such as integration fees and data migration costs, but also indirect ones, such as downtime and the loss of institutional knowledge. According to a report by the McKinsey Global Institute , these switching costs can exceed 25% of a company's annual tech budget, creating a strong disincentive for companies to change suppliers frequently. Supplier relationships can impact speed of innovation The relationship between fintech companies and their suppliers can significantly influence the pace of innovation. Suppliers of advanced technologies often have their own product roadmaps that can either align with or contradict a fintech company's goals. A survey by Accenture revealed that 60% of financial service firms felt their supplier relationships directly impacted their ability to innovate. The closer a fintech firm collaborates with its suppliers, the more likely it is to receive updates and enhancements, which can be critical for maintaining competitiveness in a rapidly evolving market. Growing number of financial technology providers increases competition among suppliers As the fintech industry expands, the number of providers offering specialized services is increasing as well. This growth, reported to be around 25% over the past three years, leads to heightened competition among suppliers. This competition can ultimately reduce supplier power, as companies are able to negotiate better terms. A report from CB Insights states that around 1,300 fintech startups were launched in 2021 alone, which prompts existing suppliers to maintain competitive pricing and enhance service delivery. Supplier Type Specialization Market Share (%) Reputation Score (1-10) AI Technology Providers Financial Analytics 30 9 Payment Processors Transaction Handling 25 8 Data Aggregators Data Management 20 7 Compliance Software Vendors Regulatory Compliance 15 8 Cybersecurity Firms Data Security 10 9 Expert-built startup financial model templates Investor-friendly Easy-to-use Excel & PPT templates CPA-developed financials 30+ charts and metrics Get Template Financial Technology - Porter's Five Forces: Bargaining power of customers SMEs have varied needs, leading to diverse options available. The landscape of financial technology solutions is highly fragmented, particularly when it comes to servicing small and medium-sized enterprises (SMEs). According to a 2022 report by Statista , there are approximately 30 million small businesses in the United States alone, each with unique financial needs and operational requirements. This diversity forces fintech companies to tailor their offerings, resulting in a plethora of options available for SMEs. As a result, the bargaining power of customers increases significantly, as they can select a solution that best fits their specific needs. Increased access to online financial tools enhances customer choice. Online financial tools have revolutionized how SMEs access financial services. The Global FinTech Report 2023 indicates that 83% of SMEs now utilize digital financial management tools. This access leads to an abundance of alternatives, allowing customers to choose between multiple vendors. Enhanced choices empower SMEs, leading to increased expectations for quality and innovation as they leverage online platforms to compare different services. Price sensitivity among SMEs can drive demands for competitive pricing. Price plays a crucial role in the decision-making process for SMEs, which often operate on tight budgets. A survey by QuickBooks revealed that nearly 75% of small business owners consider cost as the most significant factor when selecting a financial service provider. This sensitivity creates pressure on financial technology companies to adopt competitive pricing strategies, influencing the overall market dynamics. Ability to compare features and services easily through online platforms. Advancements in technology allow SMEs to research and compare features extensively. Tools like G2 and Capterra provide platforms where businesses can evaluate different financial software based on customer reviews and feature lists. A report from Forrester in 2023 found that 62% of SMEs use online comparison sites to select financial technology solutions. This ease of access to information grants power to the customer, enabling them to negotiate better terms and seek alternatives if their needs are not met. Established relationships with accounting fir",
      "entities": {
        "organizations": [
          "Financial Technology Porter",
          "Five Forces",
          "Five Forces Analysis Financial Technology",
          "Five Forces Analysis 2025",
          "Five Forces Analysis",
          "Five Forces Analysis Template",
          "Five Forces",
          "Financial Model",
          "Pitch Deck",
          "SWOT Analysis",
          "PESTEL Analysis",
          "Maketing Mix",
          "Ps",
          "BCG",
          "Financial Dashboard",
          "Five Forces Analysis",
          "Financial Technology - Porter's",
          "Limited",
          "Gartner",
          "the McKinsey Global Institute",
          "fintech",
          "Accenture",
          "CB Insights",
          "AI Technology Providers Financial Analytics",
          "Data Aggregators Data Management",
          "Cybersecurity Firms Data Security",
          "The Global FinTech Report",
          "QuickBooks",
          "Forrester"
        ],
        "people": [
          "Porter",
          "Statista"
        ],
        "locations": [
          "the United States"
        ]
      },
      "dates": [],
      "timestamp": "2025-08-14T11:00:46.615181Z",
      "content_summary": "**Financial Technology Market Analysis (2025)**\n\n**Key Insights for New Entrants:**\n\n- **Competitive Rivalry:** High, with established players like PayPal, Stripe, and Square dominating the market.\n- **Threat of Substitutes:** Moderate, with emerging technologies like blockchain and cryptocurrencies posing a threat.\n- **Threat of New Entrants:** High, due to low barriers to entry and increasing demand for digital financial services.\n- **Power of Suppliers:** Moderate, with technology providers like Amazon Web Services and Microsoft Azure offering scalable solutions.\n- **Power of Customers:** High, with consumers increasingly expecting seamless, user-friendly experiences.\n\n**Market Trends:**\n\n- Growing demand for digital payments and financial services\n- Increasing adoption of mobile banking and wallets\n- Rising importance of data security and compliance\n\n**Strategic Moves:**\n\n- Focus on developing user-friendly, secure, and scalable solutions\n- Establish partnerships with technology providers and suppliers\n- Differentiate through innovative features and services\n- Monitor emerging technologies and trends to stay competitive."
    }
  ]
}